<?xml version="1.0" encoding="UTF-8"?>
<kalendar_soutezi xmlns:xsi="http://www.w3.org/2001/XMLSchema-instance"
 xsi:schemaLocation="urn:vse:dvof01:kalendarSoutezi schema.xsd"
 xmlns="urn:vse:dvof01:kalendarSoutezi">
    <pary>
        <par id="1">
            <trida>B</trida>
            <partner>
                <idt>111</idt>
                <jmeno>Radek</jmeno>
                <prijmeni>Hrádek</prijmeni>
                <datum_narozeni>2001-04-10</datum_narozeni>
                <email>radek.hradek@gmail.com</email>
                <foto src="radek.png"></foto>
            </partner>
            <partnerka>
                <idt>222</idt>
                <jmeno>Radka</jmeno>
                <prijmeni>Hrádková</prijmeni>
                <datum_narozeni>2002-04-10</datum_narozeni>
                <email>radka.hradkova@gmail.com</email>
                <foto src="radka.png"></foto>
            </partnerka>
            <klub divize="moravskoslezska">Starlight Dance Studio</klub>
        </par>
        <par id="2">
            <trida>A</trida>
            <partner>
                <idt>333</idt>
                <jmeno>Šimon</jmeno>
                <prijmeni>Dominik</prijmeni>
                <datum_narozeni>2002-02-20</datum_narozeni>
                <email>simon.dominik@gmail.com</email>
                <foto src="simon.png"></foto>
            </partner>
            <partnerka>
                <idt>444</idt>
                <jmeno>Dominika</jmeno>
                <prijmeni>Šimonová</prijmeni>
                <datum_narozeni>2003-10-10</datum_narozeni>
                <email>dominika.simonova@gmail.com</email>
                <foto src="dominika.png"></foto>
            </partnerka>
            <klub divize="stredoceska">Rhythm  Motion Dance Academy</klub>
        </par>
        <par id="3">
            <trida>B</trida>
            <partner>
                <idt>555</idt>
                <jmeno>Tomáš</jmeno>
                <prijmeni>Koláč</prijmeni>
                <datum_narozeni>2009-11-28</datum_narozeni>
                <email>tomas.kolac@gmail.com</email>
                <foto src="tomas.png"></foto>
            </partner>
            <partnerka>
                <idt>666</idt>
                <jmeno>Antonie</jmeno>
                <prijmeni>Buchtíková</prijmeni>
                <datum_narozeni>2009-03-05</datum_narozeni>
                <email>antonie.buchtikova@gmail.com</email>
                <foto src="antonie.png"></foto>
            </partnerka>
            <klub divize="prazska">Dance Fusion Academy</klub>
        </par>
        <par id="4">
            <trida>C</trida>
            <partner>
                <idt>666</idt>
                <jmeno>Jan</jmeno>
                <prijmeni>Hrouda</prijmeni>
                <datum_narozeni>1985-04-10</datum_narozeni>
                <email>jan.hrouda@gmail.com</email>
                <foto src="jan.png"></foto>
            </partner>
            <partnerka>
                <idt>777</idt>
                <jmeno>Jana</jmeno>
                <prijmeni>Hroudová</prijmeni>
                <datum_narozeni>1987-07-20</datum_narozeni>
                <email>jana.hroudova@gmail.com</email>
                <foto src="jana.png"></foto>
            </partnerka>
            <klub divize="jihoceska">LaStDance</klub>
        </par>
    </pary>
    <soutez>
        <nazev>Ostrava Open 2024</nazev>
        <datum>2024-04-20</datum>
        <adresa>
            <lokace>Ostravar Arena</lokace>
            <ulice>U Areny</ulice>
            <cislo_popisne>123</cislo_popisne>
            <mesto>Ostrava</mesto>
            <psc>243 01</psc>
        </adresa>
        <harmonogram>
            <cas_otevreni_salu>09:00:00</cas_otevreni_salu>
            <cas_zahajeni_souteze>10:00:00</cas_zahajeni_souteze>
            <cas_konce_souteze>20:00:00</cas_konce_souteze>
        </harmonogram>
        <termin_prihlaseni>2024-03-31T23:00:00</termin_prihlaseni>
        <porota>
            <porotce>
                <jmeno>Jan</jmeno>
                <prijmeni>Klement</prijmeni>
                <mesto>Ostrava</mesto>
            </porotce>
            <porotce>
                <jmeno>Petr</jmeno>
                <prijmeni>Zajíc</prijmeni>
                <mesto>Mirošovice</mesto>
            </porotce>
        </porota>
        <kategorie typ="poharova">
            <vekova_kategorie>Dospělí</vekova_kategorie>
            <vykonostni_trida>B</vykonostni_trida>
            <vykonostni_trida>A</vykonostni_trida>
            <vykonostni_trida>M</vykonostni_trida>
            <disciplina>LAT</disciplina>
            <prihlasene_pary>
                <par_id>1</par_id>
                <par_id>2</par_id>
            </prihlasene_pary>
        </kategorie>
        <kategorie typ="liga">
            <vekova_kategorie>Mládež</vekova_kategorie>
            <disciplina>STT</disciplina>
            <prihlasene_pary>
                <par_id>3</par_id>
            </prihlasene_pary>
        </kategorie>
    </soutez>
    <soutez>
        <nazev>Velká cena města Beroun</nazev>
        <datum>2024-07-15</datum>
        <adresa>
            <lokace>Kulturní dům Plzeňka</lokace>
            <ulice>Plzeňská</ulice>
            <cislo_popisne>456</cislo_popisne>
            <mesto>Beroun</mesto>
            <psc>765 22</psc>
        </adresa>
        <harmonogram>
            <cas_otevreni_salu>08:00:00</cas_otevreni_salu>
            <cas_zahajeni_souteze>09:30:00</cas_zahajeni_souteze>
            <cas_konce_souteze>17:00:00</cas_konce_souteze>
        </harmonogram>
        <termin_prihlaseni>2024-06-30T23:00:00</termin_prihlaseni>
        <porota>
            <porotce>
                <jmeno>Jaroslav</jmeno>
                <prijmeni>Ječmen</prijmeni>
                <mesto>Pardubice</mesto>
            </porotce>
            <porotce>
                <jmeno>Ludvík</jmeno>
                <prijmeni>Ječmínek</prijmeni>
                <mesto>Plzeň</mesto>
            </porotce>
        </porota>
        <kategorie typ="postupova">
            <vekova_kategorie>Senioři</vekova_kategorie>
            <vykonostni_trida>C</vykonostni_trida>
            <disciplina>STT</disciplina>
            <prihlasene_pary>
                <par_id>4</par_id>
            </prihlasene_pary>
        </kategorie>
    </soutez>
</kalendar_soutezi>
